TSLA,Tesla Inc ,05272018,At T. Rowe Price  top Tesla funds offer split views ,BOSTON With a volatile chief executive and a potential breakthrough product starting production  Tesla Inc  is a challenging stock to hold.,topStory
TSLA,Tesla Inc ,05272018,At T. Rowe Price  top Tesla funds offer split views ,BOSTON  Aug 21 With a volatile chief executive and a potential breakthrough product starting production  Tesla Inc is a challenging stock to hold.,normal
TSLA,Tesla Inc ,05272018,Morgan Stanley halts research coverage of Tesla  shares rise ,Brokerage Morgan Stanley  has suspended equity coverage on Tesla Inc   hinting that the U.S. bank may be doing business directly with the company as it explores options to go private  pushing the electric carmaker's shares up as much as 5 percent on Tuesday.,normal
TSLA,Tesla Inc ,05272018,UPDATE 3-Morgan Stanley halts research coverage of Tesla  shares rise ,Aug 21 Brokerage Morgan Stanley has suspended equity coverage on Tesla Inc  hinting that the U.S. bank may be doing business directly with the company as it explores options to go private  pushing the electric carmaker's shares up as much as 5 percent on Tuesday.,normal
TSLA,Tesla Inc ,05272018,Morgan Stanley stops research coverage of Tesla ,Aug 21 Brokerage Morgan Stanley has halted equity coverage on Tesla Inc  potentially a sign the U.S. bank may be doing business directly with the electric carmaker as it explores options to go private.,normal
TSLA,Tesla Inc ,05272018,Norway wealth fund allowed to stay on as investor if Tesla goes private ,OSLO Rules governing Norway's $1 trillion wealth fund would allow it to stay on as an investor in Tesla  if the electric carmaker goes private  its deputy CEO said on Tuesday.,normal
TSLA,Tesla Inc ,05272018,UPDATE 2-Norway wealth fund allowed to stay on as investor if Tesla goes private ,OSLO  Aug 21 Rules governing Norway's $1 trillion wealth fund would allow it to stay on as an investor in Tesla if the electric carmaker goes private  its deputy CEO said on Tuesday.,normal
