MSFT,Microsoft Corporation,12312017,Microsoft auditing partner KPMG's anti-piracy work in India after complaint: documents ,NEW DELHI Microsoft Corp is investigating the methods partner KPMG uses to crack down on the illegal use of its software in India  after a complaint from a senior member of the country's ruling political party  documents seen by Reuters showed.,topStory
MSFT,Microsoft Corporation,12312017,Microsoft auditing partner KPMG's anti-piracy work in India after complaint -documents ,NEW DELHI  April 13 Microsoft Corp is investigating the methods partner KPMG uses to crack down on the illegal use of its software in India  after a complaint from a senior member of the country's ruling political party  documents seen by Reuters showed.,normal
TSLA,Tesla Inc ,12312017,UPDATE 4-Musk insists Tesla does not need more capital  predicts profit soon ,April 13 Tesla Inc will be profitable in the third and fourth quarters of this year and will not have to raise any money from investors  billionaire Chief Executive Elon Musk said on Friday  driving shares in the electric carmaker higher.,topStory
TSLA,Tesla Inc ,12312017,BRIEF-Elon Musk in response to CBS report tweets - "Yes  excessive automation at Tesla was a mistake" ,* "YES  EXCESSIVE AUTOMATION AT TESLA WAS A MISTAKE. TO BE PRECISE  MY MISTAKE. HUMANS ARE UNDERRATED" Further company coverage:,normal
TSLA,Tesla Inc ,12312017,Tesla to be profitable in Q3  Q4 - Musk tweets ,April 13 Silicon valley billionaire Elon Musk said on Friday his Tesla Inc company will not need to raise any money this year because the electric car maker will have positive cash flow and be profitable in the third and fourth quarter.,normal
TSLA,Tesla Inc ,12312017,BRIEF-Elon Musk Says Tesla Will Be Profitable & Cash Flow Positive In Q3 & Q4 - Tweet ,* ELON MUSK SAYS TESLA WILL BE PROFITABLE & CASH FLOW POSITIVE IN Q3 & Q4 - TWEET Further company coverage:,normal
QCOM,QUALCOMM Incorporated,12312017,BRIEF-Qualcomm Extends Cash Tender Offer For All Outstanding Shares Of NXP ,* QUALCOMM EXTENDS CASH TENDER OFFER FOR ALL OUTSTANDING SHARES OF NXP,topStory
