QCOM,QUALCOMM Incorporated,12312017,Broadcom bid for Qualcomm: The saga so far ,Broadcom Ltd  sought again to soothe U.S. security concerns around its bid for chipmaker Qualcomm Inc  on Wednesday  saying it would stick with investments aimed at maintaining the United States' leadership in 5G technology.,topStory
QCOM,QUALCOMM Incorporated,12312017,Broadcom to stick with U.S. 5G investment after Qualcomm deal ,Broadcom Ltd  sought again to soothe U.S. security concerns around its bid for chipmaker Qualcomm Inc  on Wednesday  saying it would stick with investments aimed at maintaining the United States' leadership in 5G technology.,normal
QCOM,QUALCOMM Incorporated,12312017,TIMELINE-Broadcom bid for Qualcomm: The saga so far ,March 7 Broadcom Ltd sought again to soothe U.S. security concerns around its bid for chipmaker Qualcomm Inc on Wednesday  saying it would stick with investments aimed at maintaining the United States' leadership in 5G technology.,normal
QCOM,QUALCOMM Incorporated,12312017,U.S. sees national security risk from Broadcom's Qualcomm deal ,A U.S. government national security panel has identified potential risks that warrant a full investigation of Singapore-based Broadcom Ltd's  $117 billion bid for chipmaker Qualcomm Inc   a senior U.S. Treasury official said in a letter to the companies on Monday. | Video ,normal
QCOM,QUALCOMM Incorporated,12312017,UPDATE 1-Broadcom to stick with U.S. 5G investment after Qualcomm deal ,March 7 Broadcom Ltd sought again to soothe U.S. security concerns around its bid for chipmaker Qualcomm Inc on Wednesday  saying it would stick with investments aimed at maintaining the United States' leadership in 5G technology.,normal
QCOM,QUALCOMM Incorporated,12312017,Broadcom says to stick with U.S. 5G investment after Qualcomm deal ,March 7 Singapore-based Broadcom Ltd pledged on Wednesday to make the United States the global leader in 5G technology and maintain Qualcomm's investments in the area after any merger between the two companies.,normal
QCOM,QUALCOMM Incorporated,12312017,BRIEF-Broadcom Says It Will Maintain Qualcomm's 5G R&D Resources ,* REGARDING ITS OFFER TO BUY QUALCOMM  WILL MAINTAIN RESEARCH AND DEVELOPMENT RESOURCES QUALCOMM DEVOTES TO 5G,normal
