TSLA,Tesla Inc ,06282016,TESLA SAYS DEATH OF DRIVER "IS THE FIRST KNOWN FATALITY IN JUST OVER 130 MILLION MILES WHERE AUTOPILOT WAS ACTIVATED" ,TESLA SAYS DEATH OF DRIVER "IS THE FIRST KNOWN FATALITY IN JUST OVER 130 MILLION MILES WHERE AUTOPILOT WAS ACTIVATED",topStory
TSLA,Tesla Inc ,06282016,BRIEF-Ruby Tuesday to unveil series of Tesla supercharger stations ,* First station recently opened at a Ruby Tuesday in Miner  MO  with more stations at other locations currently in planning stages or under construction  Source text for Eikon:  Further company coverage:    (Bengaluru Newsroom: +1 646 223 8780),normal
INTC,Intel Corporation,06282016,BMW  Intel  Mobileye team up to develop autonomous cars -source ,FRANKFURT  June 30 BMW is close to unveiling a development partnership for autonomous cars with Israeli collision detection software maker Mobileye and U.S. chip maker Intel  a source familiar with the matter said on Thursday.,topStory
QCOM,QUALCOMM Incorporated,06282016,BRIEF-Qualcomm files patent infringement complaints against Meizu ,* Qualcomm files patent infringement complaints against Meizu in China  Source text for Eikon:  Further company coverage:,topStory
QCOM,QUALCOMM Incorporated,06282016,Qualcomm files 17 new complaints in China courts against smartphone maker Meizu ,SHANGHAI Qualcomm Inc has filed 17 fresh complaints in China against Meizu Technology Co  stepping up its battle with the Chinese smartphone maker after the two were unable to reach a licensing accord in the U.S. tech giant's biggest market.,normal
QCOM,QUALCOMM Incorporated,06282016,Qualcomm files 17 new complaints in China courts against smartphone maker Meizu ,SHANGHAI  June 30 Qualcomm Inc has filed 17 fresh complaints in China against Meizu Technology Co  stepping up its battle with the Chinese smartphone maker after the two were unable to reach a licensing accord in the U.S. tech giant's biggest market.,normal
