MSFT,Microsoft Corporation,06282016,Microsoft wins landmark appeal over seizure of foreign emails ,NEW YORK A federal appeals court on Thursday said the U.S. government cannot force Microsoft Corp  and other companies to turn over customer emails stored on servers outside the United States.,topStory
MSFT,Microsoft Corporation,06282016,BRIEF-LinkedIn does not plan to host Q2 conf call due to pending merger ,* Due to pending merger with Microsoft  LinkedIn does not plan to host a conference call for its Q2 business results,normal
MSFT,Microsoft Corporation,06282016,UPDATE 4-Microsoft wins landmark appeal over seizure of foreign emails ,NEW YORK  July 14 A federal appeals court on Thursday said the U.S. government cannot force Microsoft Corp  and other companies to turn over customer emails stored on servers outside the United States.,normal
MSFT,Microsoft Corporation,06282016,Microsoft wins U.S. appeal over warrant for emails held abroad ,NEW YORK  July 14 Microsoft Corp won the reversal on Thursday of a court order requiring it to turn over to the U.S. government the contents of a customer's email account stored on an Irish server  in a victory for privacy advocates.,normal
TSLA,Tesla Inc ,06282016,Tesla asked to brief U.S. Senate panel on fatal Florida crash ,WASHINGTON The chairman of the U.S. Senate committee that oversees auto safety issues wrote Tesla Motors Inc Chief Executive Elon Musk on Thursday  asking the automaker to brief the committee on a fatal May 7 crash involving its Autopilot software.,topStory
TSLA,Tesla Inc ,06282016,UPDATE 4-Tesla asked to brief U.S. Senate panel on fatal Florida crash ,WASHINGTON  July 14 The chairman of the U.S. Senate committee that oversees auto safety issues wrote Tesla Motors Inc Chief Executive Elon Musk on Thursday  asking the automaker to brief the committee on a fatal May 7 crash involving its Autopilot software.,normal
TSLA,Tesla Inc ,06282016,BRIEF-Tesla's Musk says onboard vehicle logs show autopilot was turned off in Pennsylvania crash - tweet ,* Onboard vehicle logs show autopilot was turned off in Pennsylvania crash moreover  crash would not have occurred if it was on - Elon Musk tweet  Source :(http://bit.ly/29BNDn9) Further company coverage:    ),normal
TSLA,Tesla Inc ,06282016,Reuters Business News Schedule at 1230 GMT/0830 AM ET , ,normal
TSLA,Tesla Inc ,06282016,No more Tesla buyback guarantee as company cuts price of Model X ,SAN FRANCISCO/DETROIT Tesla Motors Inc has ended a program that guaranteed the resale value of its cars  and lowered the starting price of its Model X crossover  the high-profile electric vehicle maker said on Wednesday.,normal
