MSFT,Microsoft Corporation,06282016,Elon Musk-backed AI startup and Microsoft sign cloud agreement ,OpenAI  the non-profit artificial intelligence (AI) research firm backed by Tesla Motors Inc's  Elon Musk and other prominent tech executives  has signed an agreement to run most of its large-scale experiments on Microsoft Corp's  flagship cloud service  Azure.,topStory
MSFT,Microsoft Corporation,06282016,Elon Musk-backed AI startup and Microsoft sign cloud agreement ,Nov 15 OpenAI  the non-profit artificial intelligence (AI) research firm backed by Tesla Motors Inc's  Elon Musk and other prominent tech executives  has signed an agreement to run most of its large-scale experiments on Microsoft Corp's flagship cloud service  Azure.,normal
MSFT,Microsoft Corporation,06282016,BRIEF-Elon Musk's OpenAI says working with Microsoft to start running most of their large-scale experiments on Azure ,* Elon Musk's OpenAI says working with Microsoft to start running most of their large-scale experiments on Azure,normal
TSLA,Tesla Inc ,06282016,UPDATE 2-Electric-car startup Faraday Future halts work on Nevada factory ,DETROIT  Nov 15 Startup Faraday Future has stopped construction of a planned $1 billion electric vehicle factory in North Las Vegas  the company said on Tuesday  another sign of trouble for Chinese tech entrepreneur Jia Yueting  who hoped to displace Elon Musk's Tesla Motors Inc.,topStory
TSLA,Tesla Inc ,06282016,BRIEF-Tesla to raise China vehicle prices by 3 pct to 5 pct from Nov 22 ,* It will raise China vehicle prices by 3 percent to 5 percent from Nov 22    (Reporting by Beijing Monitoring Desk; Editing by Sunil Nair),normal
INTC,Intel Corporation,06282016,BRIEF-Intel announces $250 mln investment for autonomous driving ,* Intel announces $250 million investment for autonomous driving,topStory
QCOM,QUALCOMM Incorporated,06282016,US trade panel eyes Qualcomm patent complaint against Chinese firms ,WASHINGTON The U.S. International Trade Commission said on Tuesday it had voted to investigate whether some electronic mobile devices from Chinese companies contain hardware and software components that infringe upon patents owned by Qualcomm Inc .,topStory
QCOM,QUALCOMM Incorporated,06282016,US trade panel eyes Qualcomm patent complaint against Chinese firms ,WASHINGTON  Nov 15 The U.S. International Trade Commission said on Tuesday it had voted to investigate whether some electronic mobile devices from Chinese companies contain hardware and software components that infringe upon patents owned by Qualcomm Inc.,normal
