TSLA,Tesla Inc ,12312016,UPDATE 2-Tesla starts taking orders for premium solar roofs ,May 10 Tesla Inc  on Wednesday began taking orders for its solar roof tiles  a cornerstone of Elon Musk's strategy to sell a fossil-fuel-free lifestyle under the brand name of its luxury electric vehicles.,topStory
TSLA,Tesla Inc ,12312016,BRIEF-Tesla experienced cost increases from certain suppliers in order to meet quality targets ,* Tesla - experienced cost increases from certain suppliers in order to meet quality targets  development timelines and due to design changes,normal
TSLA,Tesla Inc ,12312016,BRIEF-Tesla's Musk says solar roof deployment this year in the U.S.  overseas next year - tweet ,* Tesla CEO Elon Musk says solar roof can be ordered for almost any country  deployment this year in the U.S. and overseas next year - tweet Source text: http://bit.ly/2q1BdQq,normal
TSLA,Tesla Inc ,12312016,BRIEF-Elon Musk says Tesla Solar glass roof orders open Wednesday- tweet ,* Tesla CEO Elon Musk says Tesla solar glass roof orders open Wednesday afternoon- tweet Further company coverage:,normal
NVDA,NVIDIA Corporation,12312016,Nvidia says Toyota will use its AI technology for self-driving cars ,SAN JOSE Nvidia Corp announced a partnership with Toyota Motor Corp on Wednesday  saying the Japanese car maker would use Nvidia's artificial intelligence technology to develop self-driving vehicle systems planned for the next few years.,topStory
NVDA,NVIDIA Corporation,12312016,UPDATE 1-Nvidia says Toyota will use its AI technology for self-driving cars ,SAN JOSE  May 10 Nvidia Corp announced a partnership with Toyota Motor Corp on Wednesday  saying the Japanese car maker would use Nvidia's artificial intelligence technology to develop self-driving vehicle systems planned for the next few years.,normal
NVDA,NVIDIA Corporation,12312016,Nvidia says Toyota will use its technology for self-driving cars ,SAN FRANCISCO  May 10 Nvidia Corp and Toyota Motor Corp on Wednesday in a statement said the Japanese car maker would use Nvidia's microchip technology to develop self-driving vehicle systems planned for the next few years.,normal
